{
  "seen_urls": [
    "https://mobile.ledesk.ma/encontinu/securite-alimentaire-a-accra-le-maroc-remet-2-000-tonnes-dengrais-au-ghana-et-resserre-la-cooperation-bilaterale",
    "https://www.jeuneafrique.com/brandcontent/1099575/ocp-linnovation-seve-nourriciere-dun-groupe-centenaire",
    "https://mobile.ledesk.ma/encontinu/cooperation-ocp-lance-un-projet-de-restauration-agricole-et-de-credits-carbone-au-bresil",
    "https://www.jeuneafrique.com/brandcontent/1471488/fondation-ocp-linnovation-sociale-et-la-rd-au-service-du-secteur-agricole-en-afrique",
    "https://mobile.ledesk.ma/encontinu/enr-stockage-denergie-masen-engage-le-developpement-dun-banc-dessai-pour-batteries-bess-a-noor-ouarzazate",
    "https://mobile.ledesk.ma/encontinu/innovation-lum6p-et-tanger-med-elargissent-leur-cooperation-pour-former-les-talents-du-numerique"
  ],
  "details": {
    "https://mobile.ledesk.ma/encontinu/innovation-lum6p-et-tanger-med-elargissent-leur-cooperation-pour-former-les-talents-du-numerique": {
      "Source": "Le Desk",
      "Contexte et Résumé de la publication": "L'Université Mohammed VI Polytechnique (UM6P) et le Groupe Tanger Med ont signé un nouvel accord de collaboration visant à former des talents du numérique et à ancrer l'innovation dans les réalités industrielles. Cet accord s'inscrit dans la continuité d'une coopération fructueuse et d'une vision commune pour le développement des compétences numériques au Maroc.",
      "Date de Publication": "2025-08-21",
      "Implications et Impacts sur UM6P": "Cet accord renforce le rôle de l'UM6P en tant qu'acteur clé dans la formation des talents numériques et l'innovation technologique au Maroc. Il offre également des opportunités pour des projets de recherche appliquée en collaboration avec le secteur industriel.",
      "Recommandations Stratégiques pour UM6P": "1. Développer des programmes de formation adaptés aux besoins spécifiques du Groupe Tanger Med et d'autres partenaires industriels. 2. Encourager la création de projets de recherche conjoints pour favoriser le transfert de technologie et l'innovation. 3. Évaluer régulièrement l'impact de cette collaboration pour ajuster les stratégies en fonction des résultats obtenus.",
      "Lien": "https://mobile.ledesk.ma/encontinu/innovation-lum6p-et-tanger-med-elargissent-leur-cooperation-pour-former-les-talents-du-numerique/"
    },
    "https://mobile.ledesk.ma/encontinu/cooperation-ocp-lance-un-projet-de-restauration-agricole-et-de-credits-carbone-au-bresil": {
      "Source": "Le Desk",
      "Contexte et Résumé de la publication": "Le groupe OCP, à travers OCP Brasil, s'est associé à Ambipar, la Liga do Araguaia et l'Institut Agroenvironnemental de la Vallée de l'Araguaia (IAVA) pour lancer le projet ALM Carbon. Ce projet vise la restauration agricole et la génération de crédits carbone au Brésil, en mettant l'accent sur des pratiques agricoles durables.",
      "Date de Publication": "2025-08-21",
      "Implications et Impacts sur UM6P": "Cette initiative souligne l'engagement du groupe OCP dans des projets de durabilité à l'échelle internationale. L'UM6P, en tant que partenaire académique d'OCP, pourrait jouer un rôle clé dans la recherche et le développement de pratiques agricoles durables similaires au Maroc et en Afrique.",
      "Recommandations Stratégiques pour UM6P": "1. Collaborer avec OCP pour adapter et implémenter des projets similaires au Maroc, en tirant parti des leçons apprises au Brésil. 2. Renforcer les programmes de recherche sur l'agriculture durable et la séquestration du carbone. 3. Établir des partenariats avec des institutions internationales pour partager des connaissances et des technologies en matière de durabilité agricole.",
      "Lien": "https://mobile.ledesk.ma/encontinu/cooperation-ocp-lance-un-projet-de-restauration-agricole-et-de-credits-carbone-au-bresil/"
    },
    "https://mobile.ledesk.ma/encontinu/securite-alimentaire-a-accra-le-maroc-remet-2-000-tonnes-dengrais-au-ghana-et-resserre-la-cooperation-bilaterale": {
      "Source": "Le Desk",
      "Contexte et Résumé de la publication": "Le Maroc a remis 2 000 tonnes d'engrais au Ghana, renforçant ainsi la coopération bilatérale en matière de sécurité alimentaire. Cette initiative s'inscrit dans le cadre des efforts du Maroc pour soutenir l'agriculture durable en Afrique.",
      "Date de Publication": "2025-08-21",
      "Implications et Impacts sur UM6P": "Cette action met en lumière le rôle du Maroc en tant que leader dans le domaine de la sécurité alimentaire en Afrique. L'UM6P pourrait renforcer sa position en tant que centre de recherche et d'innovation en agriculture durable, en collaborant avec des partenaires africains.",
      "Recommandations Stratégiques pour UM6P": "1. Développer des programmes de recherche conjoints avec des institutions ghanéennes sur l'agriculture durable. 2. Organiser des ateliers et des formations pour partager les meilleures pratiques en matière de fertilisation et de gestion des sols. 3. Explorer des opportunités de partenariats pour des projets de recherche appliquée en sécurité alimentaire.",
      "Lien": "https://mobile.ledesk.ma/encontinu/securite-alimentaire-a-accra-le-maroc-remet-2-000-tonnes-dengrais-au-ghana-et-resserre-la-cooperation-bilaterale/"
    },
    "https://mobile.ledesk.ma/encontinu/enr-stockage-denergie-masen-engage-le-developpement-dun-banc-dessai-pour-batteries-bess-a-noor-ouarzazate": {
      "Source": "Le Desk",
      "Contexte et Résumé de la publication": "Le groupe OCP a annoncé son intention de développer un banc d'essai pour batteries BESS à Noor Ouarzazate, visant à améliorer le stockage d'énergie renouvelable et à soutenir la transition énergétique du Maroc.",
      "Date de Publication": "2025-08-21",
      "Implications et Impacts sur UM6P": "Ce projet offre à l'UM6P une opportunité de collaborer sur des recherches avancées en matière de stockage d'énergie, renforçant ainsi son rôle dans la transition énergétique du Maroc.",
      "Recommandations Stratégiques pour UM6P": "1. Établir des partenariats de recherche avec OCP pour le développement et l'optimisation des technologies de stockage d'énergie. 2. Intégrer des modules sur le stockage d'énergie dans les programmes académiques pour former des experts dans ce domaine. 3. Organiser des séminaires et des conférences pour partager les avancées et les défis liés au stockage d'énergie renouvelable.",
      "Lien": "https://mobile.ledesk.ma/encontinu/enr-stockage-denergie-masen-engage-le-developpement-dun-banc-dessai-pour-batteries-bess-a-noor-ouarzazate/"
    },
    "https://www.jeuneafrique.com/brandcontent/1471488/fondation-ocp-linnovation-sociale-et-la-rd-au-service-du-secteur-agricole-en-afrique": {
      "Source": "Jeune Afrique",
      "Contexte et Résumé de la publication": "L'article met en lumière les initiatives de la Fondation OCP en matière d'innovation sociale et de recherche et développement (R&D) pour répondre aux défis agricoles en Afrique. Depuis 2007, la Fondation a soutenu plus de 800 coopératives au Maroc et en Afrique subsaharienne, favorisant l'inclusion économique et le développement durable. Elle collabore étroitement avec l'Université Mohammed VI Polytechnique (UM6P) pour promouvoir la recherche appliquée et le transfert de technologie, notamment dans le secteur agricole.",
      "Date de Publication": "2025-08-21",
      "Implications et Impacts sur UM6P": "Cet article souligne le rôle central de l'UM6P dans la promotion de la recherche appliquée et de l'innovation en collaboration avec la Fondation OCP. Il met en avant l'importance de l'université dans le développement de solutions adaptées aux défis agricoles africains, renforçant ainsi sa position en tant qu'acteur clé dans le domaine de la R&D agricole.",
      "Recommandations Stratégiques pour UM6P": "1. Renforcer les partenariats avec des institutions locales et internationales pour élargir les opportunités de recherche et d'innovation. 2. Développer des programmes de formation ciblés pour les chercheurs et les étudiants afin de répondre aux besoins spécifiques du secteur agricole africain. 3. Accroître la visibilité des projets de recherche de l'UM6P à travers des publications et des conférences internationales pour attirer davantage de collaborations et de financements.",
      "Lien": "https://www.jeuneafrique.com/brandcontent/1471488/fondation-ocp-linnovation-sociale-et-la-rd-au-service-du-secteur-agricole-en-afrique/"
    },
    "https://www.jeuneafrique.com/brandcontent/1099575/ocp-linnovation-seve-nourriciere-dun-groupe-centenaire": {
      "Source": "Jeune Afrique",
      "Contexte et Résumé de la publication": "L'article explore comment le Groupe OCP, acteur majeur du secteur minier, a intégré l'innovation et la recherche comme piliers de sa stratégie de développement. En collaboration avec l'Université Mohammed VI Polytechnique (UM6P), OCP a mis en place des initiatives telles que l'Institut de Promotion Socio-Educative (IPSE), le Lycée d'Excellence de Benguérir (LYDEX) et des écoles de codage comme 1337 et YouCode. Ces efforts visent à renforcer le capital humain et à promouvoir la recherche appliquée, notamment dans les domaines de l'agriculture et des énergies renouvelables.",
      "Date de Publication": "2025-08-22",
      "Implications et Impacts sur UM6P": "L'article met en évidence le rôle de l'UM6P en tant que partenaire clé du Groupe OCP dans la promotion de l'innovation et de la recherche appliquée. Il souligne l'importance de l'université dans la formation de la prochaine génération de leaders et de chercheurs, renforçant ainsi sa position en tant qu'institution académique de premier plan en Afrique.",
      "Recommandations Stratégiques pour UM6P": "1. Continuer à développer des programmes de formation en partenariat avec des acteurs industriels pour aligner les compétences des étudiants avec les besoins du marché. 2. Intensifier les efforts de recherche dans des domaines stratégiques tels que l'agriculture durable et les énergies renouvelables pour répondre aux défis du continent africain. 3. Établir des collaborations avec d'autres institutions académiques et de recherche pour renforcer les capacités de recherche et d'innovation de l'UM6P.",
      "Lien": "https://www.jeuneafrique.com/brandcontent/1099575/ocp-linnovation-seve-nourriciere-dun-groupe-centenaire/"
    }
  },
  "reports": [
    {
      "timestamp": "2025-08-23T08:22:25.732673Z",
      "new_urls": [
        "https://mobile.ledesk.ma/encontinu/cooperation-ocp-lance-un-projet-de-restauration-agricole-et-de-credits-carbone-au-bresil",
        "https://mobile.ledesk.ma/encontinu/enr-stockage-denergie-masen-engage-le-developpement-dun-banc-dessai-pour-batteries-bess-a-noor-ouarzazate",
        "https://mobile.ledesk.ma/encontinu/innovation-lum6p-et-tanger-med-elargissent-leur-cooperation-pour-former-les-talents-du-numerique",
        "https://mobile.ledesk.ma/encontinu/securite-alimentaire-a-accra-le-maroc-remet-2-000-tonnes-dengrais-au-ghana-et-resserre-la-cooperation-bilaterale",
        "https://www.jeuneafrique.com/brandcontent/1099575/ocp-linnovation-seve-nourriciere-dun-groupe-centenaire",
        "https://www.jeuneafrique.com/brandcontent/1471488/fondation-ocp-linnovation-sociale-et-la-rd-au-service-du-secteur-agricole-en-afrique"
      ],
      "report": "**RAPPORT DE VEILLE STRATÉGIQUE**\n\n*Date : 23 août 2025*\n\n---\n\n**SOURCE** : Le Desk\n\n**DATE** : 21 août 2025\n\n**RÉSUMÉ** : L'Université Mohammed VI Polytechnique (UM6P) et le Groupe Tanger Med ont signé un accord de collaboration pour former des talents du numérique et ancrer l'innovation dans les réalités industrielles. Cet accord s'inscrit dans la continuité d'une coopération fructueuse visant le développement des compétences numériques au Maroc.\n\n**IMPLICATIONS POUR UM6P** : Cet accord renforce le rôle de l'UM6P en tant qu'acteur clé dans la formation des talents numériques et l'innovation technologique au Maroc. Il offre également des opportunités pour des projets de recherche appliquée en collaboration avec le secteur industriel.\n\n**RECOMMANDATIONS** :\n\n1. Développer des programmes de formation adaptés aux besoins spécifiques du Groupe Tanger Med et d'autres partenaires industriels.\n2. Encourager la création de projets de recherche conjoints pour favoriser le transfert de technologie et l'innovation.\n3. Évaluer régulièrement l'impact de cette collaboration pour ajuster les stratégies en fonction des résultats obtenus.\n\n**LIEN** : [https://mobile.ledesk.ma/encontinu/innovation-lum6p-et-tanger-med-elargissent-leur-cooperation-pour-former-les-talents-du-numerique/](https://mobile.ledesk.ma/encontinu/innovation-lum6p-et-tanger-med-elargissent-leur-cooperation-pour-former-les-talents-du-numerique/)\n\n---\n\n**SOURCE** : Le Desk\n\n**DATE** : 21 août 2025\n\n**RÉSUMÉ** : Le groupe OCP, via OCP Brasil, s'est associé à Ambipar, la Liga do Araguaia et l'Institut Agroenvironnemental de la Vallée de l'Araguaia (IAVA) pour lancer le projet ALM Carbon. Ce projet vise la restauration agricole et la génération de crédits carbone au Brésil, en mettant l'accent sur des pratiques agricoles durables.\n\n**IMPLICATIONS POUR UM6P** : Cette initiative souligne l'engagement du groupe OCP dans des projets de durabilité à l'échelle internationale. L'UM6P, en tant que partenaire académique d'OCP, pourrait jouer un rôle clé dans la recherche et le développement de pratiques agricoles durables similaires au Maroc et en Afrique.\n\n**RECOMMANDATIONS** :\n\n1. Collaborer avec OCP pour adapter et implémenter des projets similaires au Maroc, en tirant parti des leçons apprises au Brésil.\n2. Renforcer les programmes de recherche sur l'agriculture durable et la séquestration du carbone.\n3. Établir des partenariats avec des institutions internationales pour partager des connaissances et des technologies en matière de durabilité agricole.\n\n**LIEN** : [https://mobile.ledesk.ma/encontinu/cooperation-ocp-lance-un-projet-de-restauration-agricole-et-de-credits-carbone-au-bresil/](https://mobile.ledesk.ma/encontinu/cooperation-ocp-lance-un-projet-de-restauration-agricole-et-de-credits-carbone-au-bresil/)\n\n---\n\n**SOURCE** : Le Desk\n\n**DATE** : 21 août 2025\n\n**RÉSUMÉ** : Le Maroc a remis 2 000 tonnes d'engrais au Ghana, renforçant ainsi la coopération bilatérale en matière de sécurité alimentaire. Cette initiative s'inscrit dans le cadre des efforts du Maroc pour soutenir l'agriculture durable en Afrique.\n\n**IMPLICATIONS POUR UM6P** : Cette action met en lumière le rôle du Maroc en tant que leader dans le domaine de la sécurité alimentaire en Afrique. L'UM6P pourrait renforcer sa position en tant que centre de recherche et d'innovation en agriculture durable, en collaborant avec des partenaires africains.\n\n**RECOMMANDATIONS** :\n\n1. Développer des programmes de recherche conjoints avec des institutions ghanéennes sur l'agriculture durable.\n2. Organiser des ateliers et des formations pour partager les meilleures pratiques en matière de fertilisation et de gestion des sols.\n3. Explorer des opportunités de partenariats pour des projets de recherche appliquée en sécurité alimentaire.\n\n**LIEN** : [https://mobile.ledesk.ma/encontinu/securite-alimentaire-a-accra-le-maroc-remet-2-000-tonnes-dengrais-au-ghana-et-resserre-la-cooperation-bilaterale/](https://mobile.ledesk.ma/encontinu/securite-alimentaire-a-accra-le-maroc-remet-2-000-tonnes-dengrais-au-ghana-et-resserre-la-cooperation-bilaterale/)\n\n---\n\n**SOURCE** : Le Desk\n\n**DATE** : 21 août 2025\n\n**RÉSUMÉ** : Le groupe OCP a annoncé son intention de développer un banc d'essai pour batteries BESS à Noor Ouarzazate, visant à améliorer le stockage d'énergie renouvelable et à soutenir la transition énergétique du Maroc.\n\n**IMPLICATIONS POUR UM6P** : Ce projet offre à l'UM6P une opportunité de collaborer sur des recherches avancées en matière de stockage d'énergie, renforçant ainsi son rôle dans la transition énergétique du Maroc.\n\n**RECOMMANDATIONS** :\n\n1. Établir des partenariats de recherche avec OCP pour le développement et l'optimisation des technologies de stockage d'énergie.\n2. Intégrer des modules sur le stockage d'énergie dans les programmes académiques pour former des experts dans ce domaine.\n3. Organiser des séminaires et des conférences pour partager les avancées et les défis liés au stockage d'énergie renouvelable.\n\n**LIEN** : [https://mobile.ledesk.ma/encontinu/enr-stockage-denergie-masen-engage-le-developpement-dun-banc-dessai-pour-batteries-bess-a-noor-ouarzazate/](https://mobile.ledesk.ma/encontinu/enr-stockage-denergie-masen-engage-le-developpement-dun-banc-dessai-pour-batteries-bess-a-noor-ouarzazate/)\n\n---\n\n**SOURCE** : Jeune Afrique\n\n**DATE** : 21 août 2025\n\n**RÉSUMÉ** : L'article met en lumière les initiatives de la Fondation OCP en matière d'innovation sociale et de recherche et développement (R&D) pour répondre aux défis agricoles en Afrique. Depuis 2007, la Fondation a soutenu plus de 800 coopératives au Maroc et en Afrique subsaharienne, favorisant l'inclusion économique et le développement durable. Elle collabore étroitement avec l'Université Mohammed VI Polytechnique (UM6P) pour promouvoir la recherche appliquée et le transfert de technologie, notamment dans le secteur agricole.\n\n**IMPLICATIONS POUR UM6P** : Cet article souligne le rôle central de l'UM6P dans la promotion de la recherche appliquée et de l'innovation en collaboration avec la Fondation OCP. Il met en avant l'importance de l'université dans le développement de solutions adaptées aux défis agricoles africains, renforçant ainsi sa position en tant qu'acteur clé dans le domaine de la R&D agricole.\n\n**RECOMMANDATIONS** :\n\n1. Renforcer les partenariats avec des institutions locales et internationales pour élargir les opportunités de recherche et d'innovation.\n2. Développer des programmes de formation ciblés pour les chercheurs et les étudiants afin de répondre aux besoins spécifiques du secteur agricole africain.\n3. Accroître la visibilité des projets de recherche de l'UM6P à travers des publications et des conférences internationales pour attirer davantage de collaborations et de financements.\n\n**LIEN** : [https://www.jeuneafrique.com/brandcontent/1471488/fondation-ocp-linnovation-sociale-et-la-rd-au-service-du-secteur-agricole-en-afrique/](https://www.jeuneafrique.com/brandcontent/1471488/fondation-ocp-linnovation-sociale-et-la-rd-au-service-du-secteur-agricole-en-afrique/)\n\n---\n\n**SOURCE** : Jeune Afrique\n\n**DATE** : 22 août 2025\n\n**RÉSUMÉ** : L'article explore comment le Groupe OCP, acteur majeur du secteur minier, a intégré l'innovation et la recherche comme piliers de sa stratégie de développement. En collaboration avec l'Université Mohammed VI Polytechnique (UM6P), OCP a mis en place des initiatives telles que l'Institut de Promotion Socio-Educative (IPSE), le Lycée d'Excellence de Benguérir (LYDEX) et des écoles de codage comme 1337 et YouCode. Ces efforts visent à renforcer le capital humain et à promouvoir la recherche appliquée, notamment dans les domaines de l'agriculture et des énergies renouvelables.\n\n**IMPLICATIONS POUR UM6P** : L'article met en évidence le rôle de l'UM6P en tant que partenaire clé du Groupe OCP dans la promotion de l'innovation et de la recherche appliquée. Il souligne l'importance de l'université dans la formation de la prochaine génération de leaders et de chercheurs, renforçant ainsi sa position en tant qu'institution académique de premier plan en Afrique."
    }
  ]
}
